<?xml version="1.0" encoding="UTF-8"?>
<dataroot xmlns:od="urn:schemas-microsoft-com:officedata" xmlns:xsi="http://www.w3.org/2001/XMLSchema-instance"  xsi:noNamespaceSchemaLocation="Archivos.xsd" generated="2023-12-14T15:41:42">
<Archivos>
<Num>1</Num>
<Tipo>2</Tipo>
<NombreArchivo>Fechas_semana.vba</NombreArchivo>
<File_URL>#https://github.com/AccessGlobal/VBA-Code/raw/main/Destello%20Fechas_semana/Fechas_semana.vba</File_URL>
</Archivos>
<Archivos>
<Num>28</Num>
<Tipo>2</Tipo>
<NombreArchivo>SendHTMLEmail.vba</NombreArchivo>
<File_URL>#https://github.com/AccessGlobal/VBA-Code/raw/main/Destello%20envío%20correo%20HTML/SendHTMLEmail.vba</File_URL>
</Archivos>
<Archivos>
<Num>29</Num>
<Tipo>2</Tipo>
<NombreArchivo>KillAccess.vba</NombreArchivo>
<File_URL>#https://github.com/AccessGlobal/VBA-Code/raw/main/Destello%20Kill%20Access/KillAccess.vba</File_URL>
</Archivos>
<Archivos>
<Num>32</Num>
<Tipo>2</Tipo>
<NombreArchivo>Ocultar_Access.vba</NombreArchivo>
<File_URL>#https://github.com/AccessGlobal/VBA-Code/raw/main/Destello%20Ocultar_Access/Ocultar_Access.vba</File_URL>
</Archivos>
<Archivos>
<Num>33</Num>
<Tipo>2</Tipo>
<NombreArchivo>Bloquear_cerrar_Access.vba</NombreArchivo>
<File_URL>#https://github.com/AccessGlobal/VBA-Code/raw/main/Destello%20Bloquear_cerrar_access/Bloquear_cerrar_Access.vba</File_URL>
</Archivos>
<Archivos>
<Num>35</Num>
<Tipo>2</Tipo>
<NombreArchivo>Ocultar_maximizar.vba</NombreArchivo>
<File_URL>#https://github.com/AccessGlobal/VBA-Code/raw/main/Destello%20Ocultar_maximizar/Ocultar_maximizar.vba</File_URL>
</Archivos>
<Archivos>
<Num>40</Num>
<Tipo>2</Tipo>
<NombreArchivo>AS_EsBisiesto.vba</NombreArchivo>
<File_URL>#https://github.com/AccessGlobal/VBA-Code/raw/main/AS_EsBisiesto/AS_EsBisiesto.vba</File_URL>
</Archivos>
<Archivos>
<Num>43</Num>
<Tipo>2</Tipo>
<NombreArchivo>Minicalendario.vba</NombreArchivo>
<File_URL>#https://github.com/AccessGlobal/VBA-Code/raw/main/Destello%20Minicalendario/Minicalendario.vba</File_URL>
</Archivos>
<Archivos>
<Num>44</Num>
<Tipo>2</Tipo>
<NombreArchivo>Mod_Efectos_Forms.vba</NombreArchivo>
<File_URL>#https://github.com/AccessGlobal/VBA-Code/raw/main/Destello%20Efectos%20Forms/Mod_Efectos_Forms.vba</File_URL>
</Archivos>
<Archivos>
<Num>44</Num>
<Tipo>2</Tipo>
<NombreArchivo>Mod_Form_Efectos.vba</NombreArchivo>
<File_URL>#https://github.com/AccessGlobal/VBA-Code/raw/main/Destello%20Efectos%20Forms/Mod_Form_Efectos.vba</File_URL>
</Archivos>
<Archivos>
<Num>50</Num>
<Tipo>2</Tipo>
<NombreArchivo>Estado Formulario.vba</NombreArchivo>
<File_URL>#https://github.com/AccessGlobal/VBA-Code/raw/main/Destello%20Estado%20formulario/Estado Formulario.vba</File_URL>
</Archivos>
<Archivos>
<Num>70</Num>
<Tipo>2</Tipo>
<NombreArchivo>Mover formulario.vba</NombreArchivo>
<File_URL>#https://github.com/AccessGlobal/VBA-Code/raw/main/Destello%20Mover_formulario/Mover formulario.vba</File_URL>
</Archivos>
<Archivos>
<Num>71</Num>
<Tipo>2</Tipo>
<NombreArchivo>Destello_Freefile.vba</NombreArchivo>
<File_URL>#https://github.com/AccessGlobal/VBA-Code/raw/main/Destello%20Freefile/Destello_Freefile.vba</File_URL>
</Archivos>
<Archivos>
<Num>72</Num>
<Tipo>2</Tipo>
<NombreArchivo>Destello_WhatsApp.vba</NombreArchivo>
<File_URL>#https://github.com/AccessGlobal/VBA-Code/raw/main/Destello%20WhatsApp/Destello_WhatsApp.vba</File_URL>
</Archivos>
<Archivos>
<Num>74</Num>
<Tipo>2</Tipo>
<NombreArchivo>Destello _CheckInternet.vba</NombreArchivo>
<File_URL>#https://github.com/AccessGlobal/VBA-Code/raw/main/Destello%20CheckInternet/Destello _CheckInternet.vba</File_URL>
</Archivos>
<Archivos>
<Num>79</Num>
<Tipo>2</Tipo>
<NombreArchivo>posForm.vba</NombreArchivo>
<File_URL>#https://github.com/AccessGlobal/VBA-Code/raw/main/Destello%20Posicionar_form/posForm.vba</File_URL>
</Archivos>
<Archivos>
<Num>82</Num>
<Tipo>2</Tipo>
<NombreArchivo>Sonido_en_App.vba</NombreArchivo>
<File_URL>#https://github.com/AccessGlobal/VBA-Code/raw/main/Destello%20Sonido_en_App/Sonido_en_App.vba</File_URL>
</Archivos>
<Archivos>
<Num>83</Num>
<Tipo>2</Tipo>
<NombreArchivo>Mod_mouse.vba</NombreArchivo>
<File_URL>#https://github.com/AccessGlobal/VBA-Code/raw/main/Destello%20Modificar_ratón/Mod_mouse.vba</File_URL>
</Archivos>
<Archivos>
<Num>84</Num>
<Tipo>2</Tipo>
<NombreArchivo>Cabecera_modulo.vba</NombreArchivo>
<File_URL>#https://github.com/AccessGlobal/VBA-Code/raw/main/Destello%20Cabecera%20modulo/Cabecera_modulo.vba</File_URL>
</Archivos>
<Archivos>
<Num>86</Num>
<Tipo>2</Tipo>
<NombreArchivo>CambioHorario.vba</NombreArchivo>
<File_URL>#https://github.com/AccessGlobal/VBA-Code/raw/main/Destello%20Cambio%20horario/CambioHorario.vba</File_URL>
</Archivos>
<Archivos>
<Num>90</Num>
<Tipo>2</Tipo>
<NombreArchivo>Emoticonos.vba</NombreArchivo>
<File_URL>#https://github.com/AccessGlobal/VBA-Code/raw/main/Destello%20Emoticonos/Emoticonos.vba</File_URL>
</Archivos>
<Archivos>
<Num>93</Num>
<Tipo>2</Tipo>
<NombreArchivo>Pluralize.vba</NombreArchivo>
<File_URL>#https://github.com/AccessGlobal/VBA-Code/raw/main/Destello%20Pluralize/Pluralize.vba</File_URL>
</Archivos>
<Archivos>
<Num>94</Num>
<Tipo>2</Tipo>
<NombreArchivo>Listbox_MultiSelect.vba</NombreArchivo>
<File_URL>#https://github.com/AccessGlobal/VBA-Code/raw/main/Destello%20ListBox%20selección%20múltiple/Listbox_MultiSelect.vba</File_URL>
</Archivos>
<Archivos>
<Num>96</Num>
<Tipo>2</Tipo>
<NombreArchivo>SemanaFecha.vba</NombreArchivo>
<File_URL>#https://github.com/AccessGlobal/VBA-Code/raw/main/Destello%20Semana%20fecha/SemanaFecha.vba</File_URL>
</Archivos>
<Archivos>
<Num>98</Num>
<Tipo>2</Tipo>
<NombreArchivo>Access habla.vba</NombreArchivo>
<File_URL>#https://github.com/AccessGlobal/VBA-Code/raw/main/Destello%20habla/Access habla.vba</File_URL>
</Archivos>
<Archivos>
<Num>109</Num>
<Tipo>2</Tipo>
<NombreArchivo>Ocultar_minimizar_Access.vba</NombreArchivo>
<File_URL>#https://github.com/AccessGlobal/VBA-Code/raw/main/Destello%20Ocultar%20Minimizar%20Access/Ocultar_minimizar_Access.vba</File_URL>
</Archivos>
<Archivos>
<Num>112</Num>
<Tipo>2</Tipo>
<NombreArchivo>Es_64_bits.vba</NombreArchivo>
<File_URL>#https://github.com/AccessGlobal/VBA-Code/raw/main/Destello%20Es%2064%20bits/Es_64_bits.vba</File_URL>
</Archivos>
<Archivos>
<Num>114</Num>
<Tipo>2</Tipo>
<NombreArchivo>Hora_decimal.vba</NombreArchivo>
<File_URL>#https://github.com/AccessGlobal/VBA-Code/raw/main/Destello%20Hora%20decimal/Hora_decimal.vba</File_URL>
</Archivos>
<Archivos>
<Num>120</Num>
<Tipo>2</Tipo>
<NombreArchivo>ShellExecute.vba</NombreArchivo>
<File_URL>#https://github.com/AccessGlobal/VBA-Code/raw/main/Destello%20ShellExecute/ShellExecute.vba</File_URL>
</Archivos>
<Archivos>
<Num>129</Num>
<Tipo>2</Tipo>
<NombreArchivo>FiltroForm_formulario.vba</NombreArchivo>
<File_URL>#https://github.com/AccessGlobal/VBA-Code/raw/main/Destello%20Filtros%20por%20form/FiltroForm_formulario.vba</File_URL>
</Archivos>
<Archivos>
<Num>129</Num>
<Tipo>2</Tipo>
<NombreArchivo>FiltroForm_modulo.vba</NombreArchivo>
<File_URL>#https://github.com/AccessGlobal/VBA-Code/raw/main/Destello%20Filtros%20por%20form/FiltroForm_modulo.vba</File_URL>
</Archivos>
<Archivos>
<Num>130</Num>
<Tipo>2</Tipo>
<NombreArchivo>CodigoPostalGoogle.vba</NombreArchivo>
<File_URL>#https://github.com/AccessGlobal/VBA-Code/raw/main/Destello%20Codigo%20Postal%20Google/CodigoPostalGoogle.vba</File_URL>
</Archivos>
<Archivos>
<Num>131</Num>
<Tipo>2</Tipo>
<NombreArchivo>DistanciaCoordenadas.vba</NombreArchivo>
<File_URL>#https://github.com/AccessGlobal/VBA-Code/raw/main/Destello%20Distancia%20entre%20coordenadas/DistanciaCoordenadas.vba</File_URL>
</Archivos>
<Archivos>
<Num>132</Num>
<Tipo>2</Tipo>
<NombreArchivo>Pitagoras.vba</NombreArchivo>
<File_URL>#https://github.com/AccessGlobal/VBA-Code/raw/main/Destello%20Distancia%20Pitagoras/Pitagoras.vba</File_URL>
</Archivos>
<Archivos>
<Num>133</Num>
<Tipo>2</Tipo>
<NombreArchivo>Vicenty.vba</NombreArchivo>
<File_URL>#https://github.com/AccessGlobal/VBA-Code/raw/main/Destello%20distancia%20Vicenty/Vicenty.vba</File_URL>
</Archivos>
<Archivos>
<Num>135</Num>
<Tipo>2</Tipo>
<NombreArchivo>PausarCodigo.vba</NombreArchivo>
<File_URL>#https://github.com/AccessGlobal/VBA-Code/raw/main/Destello%20Pausar%20codigo/PausarCodigo.vba</File_URL>
</Archivos>
<Archivos>
<Num>140</Num>
<Tipo>2</Tipo>
<NombreArchivo>Form_redondo.vba</NombreArchivo>
<File_URL>#https://github.com/AccessGlobal/VBA-Code/raw/main/Destello%20Form%20redondo/Form_redondo.vba</File_URL>
</Archivos>
<Archivos>
<Num>143</Num>
<Tipo>2</Tipo>
<NombreArchivo>Exporta Excel.vba</NombreArchivo>
<File_URL>#https://github.com/AccessGlobal/VBA-Code/raw/main/Destello%20Exporta%20Excel/Exporta Excel.vba</File_URL>
</Archivos>
<Archivos>
<Num>147</Num>
<Tipo>2</Tipo>
<NombreArchivo>SoloNumeros.vba</NombreArchivo>
<File_URL>#https://github.com/AccessGlobal/VBA-Code/raw/main/Destello%20Sólo%20números/SoloNumeros.vba</File_URL>
</Archivos>
<Archivos>
<Num>148</Num>
<Tipo>2</Tipo>
<NombreArchivo>Enviar_a_papelera.vba</NombreArchivo>
<File_URL>#https://github.com/AccessGlobal/VBA-Code/raw/main/Destello%20Enviar%20a%20papelera/Enviar_a_papelera.vba</File_URL>
</Archivos>
<Archivos>
<Num>149</Num>
<Tipo>2</Tipo>
<NombreArchivo>CapturaPantalla.vba</NombreArchivo>
<File_URL>#https://github.com/AccessGlobal/VBA-Code/raw/main/Destello%20Captura%20Pantalla/CapturaPantalla.vba</File_URL>
</Archivos>
<Archivos>
<Num>150</Num>
<Tipo>2</Tipo>
<NombreArchivo>RecuperaPapelera.vba</NombreArchivo>
<File_URL>#https://github.com/AccessGlobal/VBA-Code/raw/main/Destello%20Recupera%20papelera/RecuperaPapelera.vba</File_URL>
</Archivos>
<Archivos>
<Num>151</Num>
<Tipo>2</Tipo>
<NombreArchivo>GetCapsLock.vba</NombreArchivo>
<File_URL>#https://github.com/AccessGlobal/VBA-Code/raw/main/Destello%20GetCapsLock/GetCapsLock.vba</File_URL>
</Archivos>
<Archivos>
<Num>152</Num>
<Tipo>2</Tipo>
<NombreArchivo>GetAttr.vba</NombreArchivo>
<File_URL>#https://github.com/AccessGlobal/VBA-Code/raw/main/Destello%20GetAttr/GetAttr.vba</File_URL>
</Archivos>
<Archivos>
<Num>157</Num>